Link,Title,Location,Salary,Summary
https://kr.indeed.com//rc/clk?jk=1b28e89d02afb811&fccid=0bed8e17bc113980&vjs=3,[Consumer Health] Korea Supply Chain Head,서울,,"oriented and ability to follow through on committed tasks Long-
term thinking, innovative & collaborative working Min. fluent..."
https://kr.indeed.com//rc/clk?jk=5b0e780782510453&fccid=808e2935083ffe8b&vjs=3,Team Assistant,인천,,"commission of any... acts. The 
term “sexual exploitation” means any actual... conditions. The 
term “sexual harassment..."
https://kr.indeed.com//rc/clk?jk=a39a0db2e06d27f6&fccid=2f78c666a1ead0f5&vjs=3,Technical Director,대한민국,,"strategic and policy development aspects... have medium 
term consequences... operation... function and perhaps..."
https://kr.indeed.com//rc/clk?jk=c80c823f4c170fe4&fccid=c46411dafcae5d08&vjs=3,Field Engineer,서울,,"so you can grow your career and expand your skills... long 
term. Cytiva is proud to work alongside a community of nine..."
https://kr.indeed.com//rc/clk?jk=4ab5450862f0fc1f&fccid=c46411dafcae5d08&vjs=3,GM Research – Asia Pacific,서울,,"so you can grow your career and expand your skills... long 
term. Cytiva is proud to work alongside a community of nine..."
https://kr.indeed.com//rc/clk?jk=6e21827b355000d7&fccid=9895201438a0a07b&vjs=3,Information Technology Specialist (Policy and Planning),대한민국,,"Land & base management Certain current or former 
term or temporary federal employees of a land or base management agency..."
https://kr.indeed.com//rc/clk?jk=3d177e960d471bef&fccid=04233dcb6353e8e1&vjs=3,"NMD Medical Science Liaison, South Korea",서울,,"products, disease state and competitors Establishes long 
term scientific/strategic relationships with leading specialists..."
https://kr.indeed.com//rc/clk?jk=3ae73b094ebd696b&fccid=5ab871579f4889e6&vjs=3,Junior Innovation Advisor,대한민국,,"strong interpersonal skills and ability to create positive, long-
term working relationships by demonstrating a commitment..."
https://kr.indeed.com//company/SPEP/jobs/Corporate-Trainer-Seoul-bef08cc5e2ac866f?fccid=30b98e467e4c6c96&vjs=3,[PT/2-Week Short-Term] Corporate Trainer – Seoul / Virtual,서울 압구정동,,"*[PT/2-Week Short-
Term] Corporate Trainer – Seoul Apgujeong / Virtual Class* *[Job Description... Type of Class: Intensive..."
https://kr.indeed.com//rc/clk?jk=ac9489554e710e43&fccid=c6aa811dbc7507a8&vjs=3,August Positions at CHUNGDAHM Learning,대한민국,,"class on average) all contracts... minimum one year 
term E2 sponsorship (if required) Rent-free housing Requirements..."
https://kr.indeed.com//rc/clk?jk=4aa8050b67156be0&fccid=734cb5a01ee60f80&vjs=3,Integrated Marketing Manager - Gaming Korea & Japan,서울,,"relationships building, capable of shaping productive long-
term relations with external partners by providing continuous..."
https://kr.indeed.com//rc/clk?jk=29c835e43da8a8ab&fccid=e87d9cecd33775c9&vjs=3,Director-SCM,서울,,"Subsidiary’s executive management team to establish long-
term and seasonal Go-To-Market strategies... responsible..."
https://kr.indeed.com//rc/clk?jk=d9de657d14534741&fccid=41d0dee1481d025b&vjs=3,Hiring Junior Literature & Subjects Teachers,대한민국,,"provided after successful completion of contracted 
term. [Housing Support] Company will provide housing stipend..."
https://kr.indeed.com//rc/clk?jk=1c30f68b32045107&fccid=af17ea0d1d6bbbba&vjs=3,Country IKEA Food Manager - IKEA Korea,경기도,,"IKEA tone of voice. •Ability to take a holistic and long-
term view and identify business opportunities accordingly combined..."
https://kr.indeed.com//rc/clk?jk=00cb2517ed7233b0&fccid=3444e7c94299ba32&vjs=3,PE Safety & Security Head of Korea,서울,,"We create value with intellectual property and long-
term research, led... award-winning Nokia Bell Labs. Adhering..."
https://kr.indeed.com//rc/clk?jk=2456cfd18867f542&fccid=e05a0d0b33ce6f6f&vjs=3,외교부 장관 Financial Times紙 인터뷰,서울 종로구,,"kind of mid- and long-
term approach... dilemma we are facing... pursue the mid- and long-
term policies you need..."
https://kr.indeed.com//rc/clk?jk=e4acc7c8df45a38a&fccid=65ae769cb89830ec&vjs=3,INTERN - PUBLIC INFORMATION [Temporary],인천,,"short, medium and long 
term as well... commission of any... acts. The 
term “sexual exploitation” means any actual..."
https://kr.indeed.com//rc/clk?jk=ce37da3523abb35c&fccid=aaf3b433897ea465&vjs=3,CIB - Equity Research - Research Analyst - Fixed Term Contra...,서울,,"drives everything we do. We strive to build trusted, long-
term partnerships to help our clients achieve... business..."
https://kr.indeed.com//rc/clk?jk=82409e437446e212&fccid=f06a4d05bf5510ec&vjs=3,"Sales Representative I, ENT & Neurotechnology",서울,,"Responsible for developing, building, and strengthening long-
term relationships... stakeholders including distributors..."
https://kr.indeed.com//rc/clk?jk=8d710489792afed9&fccid=c1099851e9794854&vjs=3,"Engineering Program Manager (EPM), Korea",서울,,"environment. - Preference given to candidates that open to relocation or long 
term assignment to other Asian country."
https://kr.indeed.com//rc/clk?jk=6fd6e4eb56de0d71&fccid=aaf3b433897ea465&vjs=3,"Human Resources Business Advisory, Associate",서울,,"drives everything we do. We strive to build trusted, long-
term partnerships to help our clients achieve... business..."
https://kr.indeed.com//rc/clk?jk=702d0ac22f5ed0be&fccid=65ae769cb89830ec&vjs=3,INTERN - PROGRAMME MANAGEMENT [Temporary],인천,,"commission of any... acts. The 
term “sexual exploitation” means any actual... conditions. The 
term “sexual harassment..."
https://kr.indeed.com//rc/clk?jk=edfeb0352251440c&fccid=a5b4499d9e91a5c6&vjs=3,"Payments Compliance Manager, (Korean, English)",서울,,"risks... name Google came from ""googol,"" a mathematical 
term... number 1 followed by 100 zeros. And nobody at Google..."
https://kr.indeed.com//rc/clk?jk=1e50850cb5976173&fccid=c3b8389ba1f05d96&vjs=3,CYS Program Associate Instructor NF-03,대한민국,,"Tracks participant's accomplishments, long and short 
term goals, effort, and evaluations as appropriate for age and type..."
https://kr.indeed.com//rc/clk?jk=b3de8fa31680f961&fccid=1639254ea84748b5&vjs=3,"Head of Public Figures and Creators, South Korea",경기도,,"media partnerships / public figures and establishing long 
term relationships Knowledge... South Korea media landscape, eg..."
https://kr.indeed.com//rc/clk?jk=59a365d5020f8c1e&fccid=2c62e4de04b8f952&vjs=3,Sourcing(Procurement) Manager,서울,,"tools... Coupa Sourcing... ability to craft long-
term internal and external business relationships; cause and manage..."
https://kr.indeed.com//rc/clk?jk=61c7c4d0f57e34cd&fccid=5f3d6765ff4e19b6&vjs=3,"Regional Director, South Korea",대한민국,,"leaders. Assist... planning and coordinating... annual and 
term-specific hybrid and F2F schedule of classes. Assist..."
https://kr.indeed.com//rc/clk?jk=f4575fd8d13aec0f&fccid=5eccd1299a99950e&vjs=3,Store Manager,대한민국,,"maintain a long 
term relationship... skills and ability to maintain long-
term with clients and community and understands..."
https://kr.indeed.com//rc/clk?jk=aedfed2f7e71b84f&fccid=f06a4d05bf5510ec&vjs=3,"Sales Representative I-II, CRHF",서울,,"Responsible for developing, building, and strengthening long-
term relationships... stakeholders including distributors..."
https://kr.indeed.com//rc/clk?jk=facd993c88b0ff36&fccid=33fa1494c1a3ee87&vjs=3,Product Management Infotainment and MMC Specialist,서울,,"product information for proper alignment with short- and mid-
term volume planningrepresent brand and respective products..."
https://kr.indeed.com//rc/clk?jk=3779d4785a680055&fccid=af17ea0d1d6bbbba&vjs=3,Store Visual Merchandiser / Activity Co-worker - IKEA Goyang...,경기도 고양,,"initiatives... grow the business and support long-
term profitability and execute the agreed plans in close co..."
https://kr.indeed.com//rc/clk?jk=eab0b42b78d6d784&fccid=1c76c3a36f6c7557&vjs=3,"Research Analyst, Consumer Sector",서울,,"forecast financial models to generate short/long 
term business projections • provide investment recommendations based..."
https://kr.indeed.com//rc/clk?jk=0e9158aa40b6f123&fccid=5f3d6765ff4e19b6&vjs=3,"Assistant Director, Camp Humphreys",대한민국,,"process efficiencies Assist the RD with creation of annual and 
term course schedules Collaborate... Regional Director..."
https://kr.indeed.com//rc/clk?jk=89f20c4eca4f47e5&fccid=edae4285faf6c2f0&vjs=3,Industrial Engineer - Korea,부산,,"United States... position... hired on a 2 year fixed 
term contract with possibility to convert to an open ended..."
https://kr.indeed.com//rc/clk?jk=874e220a355fe468&fccid=0d9dd14963f1f7df&vjs=3,[외국계]게팅게 메디칼 코리아 IWS product specialist,서울 강남구,,"order intake targets- Responsible for building a long-
term relations with hospitals and other stakeholders focusing..."
https://kr.indeed.com//rc/clk?jk=d1e9585cdef45f63&fccid=a5b0232167551bf2&vjs=3,Ready and Resilient Program Manager,대한민국,,"Land & base management Certain current or former 
term or temporary federal employees of a land or base management agency..."
https://kr.indeed.com//rc/clk?jk=49d30a1ef1ebe720&fccid=3c3987cd94a7ccbf&vjs=3,QROAD Global Company Game Operations PM,서울,,"Experience in planning and implementing short-
term and long-
term projects Required to attend overseas business trips..."
https://kr.indeed.com//rc/clk?jk=60ab98d2255e04f0&fccid=aaf3b433897ea465&vjs=3,CIB F&BM - Legal Entity Controller - Analyst - Korea,서울,,"drives everything we do. We strive to build trusted, long-
term partnerships to help our clients achieve... business..."
https://kr.indeed.com//rc/clk?jk=ab6a9bc7823df341&fccid=14e7391c55beeb80&vjs=3,Sales Representative,서울,,"met, not only in terms of Ocean volume & revenue, but also in 
term of Logistics and Services GP... Fast-Moving Consumer..."
https://kr.indeed.com//rc/clk?jk=7376c42563eace33&fccid=aaf3b433897ea465&vjs=3,CIB - Equity Research Analyst,서울,,"drives everything we do. We strive to build trusted, long-
term partnerships to help our clients achieve... business..."
https://kr.indeed.com//rc/clk?jk=21d303a2d2faca7c&fccid=705a30fae5ffadc9&vjs=3,Field Service Engineer,경기도 성남,,"site based customer contact. You will perform the short 
term planning, coordination and execution of planned and corrective..."
https://kr.indeed.com//rc/clk?jk=0a64d1b6ea710c62&fccid=38313780e9822361&vjs=3,Sales Manager,서울,,"industrial manufacturing) Develop and maintain strategic long-
term business relationships with respective accounts Reginal..."
https://kr.indeed.com//rc/clk?jk=dbc10060de1bf7c1&fccid=6a2be34af774e2bb&vjs=3,eCommerce Director,서울,,"ownership within ecommerce brands websites Develop short- and long-
term plans and budgets... e-commerce platform and its..."
https://kr.indeed.com//rc/clk?jk=31d944624fef4ba7&fccid=e55924959400876c&vjs=3,"SHE (Safety, Health & Officer) Officer",대한민국,,"environmental compliance. Good level of expertise required in 
term of SHE knowledges. Preferably working knowledge in Lean..."
https://kr.indeed.com//rc/clk?jk=8706aa086309ba1a&fccid=35d653c09c2712b6&vjs=3,"Category Manager, Fashion & Living - Korea",서울,,"developing and executing a long-
term business strategy for Fashion and Living... execute a long-
term business development..."
https://kr.indeed.com//rc/clk?jk=3a971b518fef36bf&fccid=a6a6cb08ca92cc4b&vjs=3,Application Scientist,서울,,"partners and market conditions consistent... long-
term goals... company. Carry out customer demonstrations..."
https://kr.indeed.com//rc/clk?jk=9eec6f33981cdbb3&fccid=1807e5727f702882&vjs=3,Retail Manager,서울,,"local market and business world Nurture positive long-
term business relations Propose and participate in public relations..."
https://kr.indeed.com//rc/clk?jk=b4487742c6d99e96&fccid=0bed8e17bc113980&vjs=3,[Janssen] Data Management Specialist,서울,,"2. 계열사: 한국얀센 (Janssen) 3. 근무지: 서울시 용산구 4. 근무 형태: Fixed 
Term (계약직) [Responsibilities] 1. Supports internal sales data..."
https://kr.indeed.com//rc/clk?jk=ebc87c8c03c8e2f6&fccid=1747ef880c1e67fb&vjs=3,[해외취업] 뉴욕 최대 식품유통 기업 Graphic Designer 구인!,서울 역삼동,"연봉 34,000,000원 - 45,000,000원","marketing managers to establish and renew short and long 
term strategic design goals. • Communicate with management..."
https://kr.indeed.com//rc/clk?jk=6f6deb74b0a1a3ed&fccid=3444e7c94299ba32&vjs=3,RAN Engineer,서울,,"We create value with intellectual property and long-
term research, led... award-winning Nokia Bell Labs. Adhering..."
