Link,Title,Location,Salary,Summary
https://kr.indeed.com//rc/clk?jk=a9b9716467a2c63a&fccid=0bed8e17bc113980&vjs=3,"Regional Marketing Director, Immuno Dermatology",대한민국,,"Pacific customers, as well as guide the short to mid-
term commercial strategy for our inline portfolio... require you..."
https://kr.indeed.com//rc/clk?jk=6f6903014017b5c9&fccid=808e2935083ffe8b&vjs=3,Intern - Public Information,인천,,"short, medium and long 
term as well... commission of any... acts. The 
term “sexual exploitation” means any actual..."
https://kr.indeed.com//rc/clk?jk=aa4b7f6524eb3503&fccid=bb89ca6de220f5a5&vjs=3,Community Associate (1-year Contract),서울,,"City:Seoul Country:Korea, Republic of Contract Type:Fixed 
Term Employee Type:Full Time Community Associate At Regus, we’ve..."
https://kr.indeed.com//rc/clk?jk=506c3ca7e9e08182&fccid=ded5cbfbf47c72c8&vjs=3,MITG Sales Rep I (1 yr Contract),서울 강남구,,"building, and strengthening long-
term relationships with stakeholders including... Temporary Work / Fixed 
Term Job Level..."
https://kr.indeed.com//rc/clk?jk=8832ef3d836fbdb8&fccid=aaf3b433897ea465&vjs=3,CAO - Global Business & Document Services - Client Service R...,서울,,"drives everything we do. We strive to build trusted, long-
term partnerships to help our clients achieve... business..."
https://kr.indeed.com//rc/clk?jk=dc0207b37c9cfad2&fccid=caf13310328577e3&vjs=3,[해외취업] 뉴욕 물류 포워딩 전문 업체 물류 인턴,서울 여의도,"연봉 24,000,000원 - 36,000,000원","your outcome in mind... strive to create a long 
term personalized relationship with all our clients by demonstrating..."
https://kr.indeed.com//rc/clk?jk=556a75db65c563f1&fccid=4027cfd917e1ee29&vjs=3,"Analyst, Public Relations and Customer Marketing",서울,,"also play key role in developing and nurturing long-
term strategic marketing relationships with Salesforce's most innovative..."
https://kr.indeed.com//rc/clk?jk=02557f336a1b6c98&fccid=396f5ba534ee585d&vjs=3,Talent Acquisition Manager,서울,,"key to our long-
term success. JOB... team members Ability to see short 
term and long 
term effects of possible actions..."
https://kr.indeed.com//rc/clk?jk=4857aad7b2601446&fccid=6902b1131240791f&vjs=3,KR_HP_Clinical Trial Manager,대한민국,,"humans and animals... family owned company, we focus on long 
term performance. We are powered by 50,000 employees globally..."
https://kr.indeed.com//rc/clk?jk=4edea1316095e0fc&fccid=fb8ad3a6b087f516&vjs=3,Hiring Gyopo English Teachers for R&D position,서울 강남구,,"exit pay), return flight (upon completion of 2 year full-
term) Housing: Provided upon request Days Off: 10 days and extra..."
"https://kr.indeed.com//company/Strikingly,-Inc/jobs/Bilingual-Non-Voice-Customer-Support-0027a3d008ecce2c?fccid=22d596111db9ce9c&vjs=3",Bilingual (Korean-English) Non-Voice Customer Support,서울 여의도역•원격 근무,,"full-time... long-
term work from home job. If you are looking... stable and long-
term job, submit your proposal..."
https://kr.indeed.com//rc/clk?jk=960f0512469db7de&fccid=c46411dafcae5d08&vjs=3,Customer Service-Order Management Specialist,서울,,"so you can grow your career and expand your skills... long 
term. Cytiva is proud to work alongside a community of nine..."
https://kr.indeed.com//rc/clk?jk=6ebdf677866c8cbf&fccid=0bed8e17bc113980&vjs=3,[Consumer Health] Sr. Brand Manager,서울,,"innovative and achievable business plans 3) Lead short- and long-
term portfolio plans and development for sustainable brand..."
https://kr.indeed.com//rc/clk?jk=7fe887442b5d19bf&fccid=f33adcecbae03a00&vjs=3,Assistant Accountant (Fixed Term Contract),서울,,"Who We Are BD is a leading global medical technology company that creates medical technology, devices and laboratory..."
https://kr.indeed.com//rc/clk?jk=d4403c9aa0da3ead&fccid=c72e2ae5b5136bdf&vjs=3,May 14th ESL Full & Part Time,대한민국,,"Songdo, Incheon 2. Teaching level: Elementary (5 position) 3. 
Term of Employment: June 14th ~ Aug.20th 4. Working hours: 9:30..."
https://kr.indeed.com//rc/clk?jk=d25de9b19acc9f56&fccid=3b89b9ec324f96c8&vjs=3,"Mendix Sales Director, South Korea",서울,,"impact... world. So, if you aim high and think long 
term…you belong here. We innovate. We want... what happens next..."
https://kr.indeed.com//rc/clk?jk=991fc58550549fe7&fccid=4edf263374ff05e2&vjs=3,[제약] Supply Chain Planner,서울,,"sales potential. Contacting point... distributors in 
term of all inbound process, logistic planning and warehousing..."
https://kr.indeed.com//rc/clk?jk=2a643a6e29fc9104&fccid=b739c7fad36227f6&vjs=3,외국계 회사 UPS Engineer,경기도 이천,,"after sales service. The best technology is only as good... long 
term... service that underpins... purpose..."
https://kr.indeed.com//rc/clk?jk=775b474e3b5f6e97&fccid=38c0d5e4f2a99768&vjs=3,Assistant Engineer,서울,,"Profit Share scheme, additional fringe benefits and long-
term career development opportunities. Personal data collected..."
https://kr.indeed.com//rc/clk?jk=691abd88553b0e92&fccid=7650303dc4b27449&vjs=3,Supply Chain Operations Specialist,서울,,"Planner. Collaborate... CMO Planner... management of short-
term schedule changes. Provide feasibility assessments..."
https://kr.indeed.com//rc/clk?jk=ac503d0963ab7ca0&fccid=c46411dafcae5d08&vjs=3,EHS Specialist,서울,,"so you can grow your career and expand your skills... long 
term. Cytiva is proud to work alongside a community of nine..."
https://kr.indeed.com//rc/clk?jk=23272d076efc8c75&fccid=79b1953a75a5cc1a&vjs=3,Laundry & Home Care Key Account Manager,대한민국,,"solution selling Develop and maintain sustainable and long-
term relationships with key accounts, key executives and sponsors..."
https://kr.indeed.com//rc/clk?jk=08e62a133640c7fc&fccid=b3a3d9b7840e20cb&vjs=3,Process Research & Development Specialist,대한민국,,"up activities for new products. Develop short, medium and long 
term scale-up and manufacturing strategies for new products..."
https://kr.indeed.com//rc/clk?jk=57f5d2e71f85019f&fccid=808e2935083ffe8b&vjs=3,Intern - Information Systems and Communication Technology (1...,인천,,"commission of any... acts. The 
term “sexual exploitation” means any actual... conditions. The 
term “sexual harassment..."
https://kr.indeed.com//rc/clk?jk=74c5ce8cbc6bd748&fccid=c46411dafcae5d08&vjs=3,Contract and Compliance Manager,서울,,"so you can grow your career and expand your skills... long 
term. Cytiva is proud to work alongside a community of nine..."
https://kr.indeed.com//rc/clk?jk=a14f472ffcda3239&fccid=8686937f641f561b&vjs=3,"Manager, Web & App merchandising, eCom",서울,,"experience to drive a website/mobile site renewal project or mid-
term(over 5 months) project • Experience on web analytics..."
https://kr.indeed.com//rc/clk?jk=be2590d6d6a70fd3&fccid=77cec2f25f9bd7ed&vjs=3,Global Technology Strategist,서울,,"Global Enterprise Manager on developing and executing on a long 
term technical strategy within the areas of Cloud, Enterprise..."
https://kr.indeed.com//rc/clk?jk=e64d2f1e2de938b4&fccid=fe2d21eef233e94a&vjs=3,Solutions Architect,서울,,"managers within your larger organization when discussing mid-
term customer strategy and architectural best practices · We..."
https://kr.indeed.com//rc/clk?jk=2b5c2c72c2e1ebbc&fccid=e9e363d6332bc1cd&vjs=3,Sales Resident Engineer,서울,,"fosters a long-
term business relationship Communicate key issues and advise customers on short-and long-
term product..."
https://kr.indeed.com//rc/clk?jk=1aa21d690a0bf3e3&fccid=366382f52796fce2&vjs=3,Logistics Manager,서울,,"focusing on long and short-
term views. 2... Long 
term & yearly logistics strategies and capacity master plans vs. long-
term..."
https://kr.indeed.com//rc/clk?jk=484c2fb8541a6199&fccid=ef91189cf0433c03&vjs=3,VP Sales – Korea,서울,,"develop long-
term relationships... role Excellent balance of long 
term and short-
term focus Proficiency in Microsoft..."
https://kr.indeed.com//rc/clk?jk=e6f50d5e2e4a7122&fccid=42902ed7252fb8a2&vjs=3,Associate Senior Translator,서울,,"house and freelance translators. quality assurance). Category Language Delivery Operations Job Type Fixed 
Term Contract"
https://kr.indeed.com//rc/clk?jk=3a440f6cd737cdb6&fccid=c72e2ae5b5136bdf&vjs=3,June 11th ESL Full & Part Time,대한민국,,"Songdo, Incheon 2. Teaching level: Elementary (5 position) 3. 
Term of Employment: June 14th ~ Aug.20th 4. Working hours: 9:30..."
https://kr.indeed.com//rc/clk?jk=2a701d07b4f173ae&fccid=6576e7250aa78c3c&vjs=3,HR Specialist,서울,,"day-to-day HR operations and articulate an inspiring long-
term HR vision... role, you will lead HR related matters..."
https://kr.indeed.com//rc/clk?jk=f0ac09b6e56ee3b6&fccid=cbfa56f19cc95796&vjs=3,Special Operations Certified Athletic Trainer (Camp Humphrey...,대한민국+1 지역,,"Centers (HPTCs). Assist... preparation of short and long-
term fiscal plans. Submit input... HP program Manager..."
https://kr.indeed.com//rc/clk?jk=df33841c82f96ee5&fccid=d978f32fdde7371d&vjs=3,EQUIPMENT SPECIALIST (WEAPONS DELIVERY SYSTEM) - AFETS,대한민국,,"disabilities Land & base management Certain current or former 
term or temporary federal employees of a land or base..."
https://kr.indeed.com//rc/clk?jk=a02b48c71cba4e6f&fccid=6c2cf7dd916de331&vjs=3,Commercial&Digital IT Analyst,서울,,"advisory... groups on digital IT solutions and drive near 
term IT investment planning. Partner with business to capture..."
https://kr.indeed.com//rc/clk?jk=27909dc2bdbdd7b5&fccid=8fac1f110688f6ef&vjs=3,BALENCIAGA Assistant Project Manager,서울,,"how to excel in our company. Job Type Fixed 
Term (Fixed 
Term) Start Date 2021-08-30 Schedule Full time Organization..."
https://kr.indeed.com//rc/clk?jk=19c2aecc93b3d299&fccid=c320c000a5dbe639&vjs=3,Maintenance Engineer (E&I),대한민국,,"Review annual shutdown maintenance work plan including 4yr long-
term shutdown Perform immediate action for unplanned shutdown..."
https://kr.indeed.com//rc/clk?jk=ce7849f8b35e1c3e&fccid=448951d0ddf03e0c&vjs=3,Technical Enablement Manager,서울,,"continues to innovate... well positioned... long 
term. Equal Opportunity at Datadog: Datadog is an Affirmative..."
https://kr.indeed.com//rc/clk?jk=7e3ec0c2a8bb8341&fccid=0a3a7f6d232558fc&vjs=3,Event Management Assistant for GGGWeek2021 and COP26 events...,서울,,"support Members and Partners on NDC enhancement, Long 
Term Low Emissions Development Strategies, MRV and Transparency..."
https://kr.indeed.com//rc/clk?jk=51223726ccca976c&fccid=a5b4499d9e91a5c6&vjs=3,Strategic Partnerships Development Manager (Korean),서울,,"always trying to exceed... expectations and strengthen our long-
term partner relationships. We help grow Google's business..."
https://kr.indeed.com//rc/clk?jk=5266b4675c117150&fccid=efd76c98bd20bd43&vjs=3,FSE Supervisor,대한민국,,"accounting of all fuel. Reviews and evaluates short- and long-
term mission requirements in terms... fuel operations..."
https://kr.indeed.com//rc/clk?jk=785e72b82bcaf398&fccid=bf8931af018e76aa&vjs=3,SUPERVISORY LOGISTICS MANAGEMENT SPECIALIST,대한민국,,"short and long 
term operational plans... management Certain current or former 
term or temporary federal employees of a land..."
https://kr.indeed.com//rc/clk?jk=41db01cc3877d021&fccid=fe2d21eef233e94a&vjs=3,Selling Partner Support Associate,서울,,"Position Description: Global Seller Support Associate (Fixed-
term... Seller Support Associate acts... primary..."
https://kr.indeed.com//rc/clk?jk=1cbfd31eb3e7a060&fccid=0bed8e17bc113980&vjs=3,[Janssen] Associate EHS Specialist,경기도 화성,,"2. 계열사: 한국얀센 (Janssen) 3. 근무지: 경기도 화성시 4. 근무 형태: Fixed 
Term (About 8 months) [Responsibilities] - Ensure compliance..."
https://kr.indeed.com//rc/clk?jk=723cd0bc4750b775&fccid=8aa1979f07fe6b4d&vjs=3,Business Development Manager Korea (m/f/d),서울,,"Deal maker and person of action – You will develop long-
term business growth strategies, negotiate sustainable and sensible..."
https://kr.indeed.com//rc/clk?jk=2741253de882f237&fccid=ef7ecb35bcf9a2de&vjs=3,"Digital/PR Marketing 팀장(8-12년, 과차장급)-유명글로벌소비재",서울 강남구,,"ž Develop digital marketing strategy for mid/longer 
term ž Develop category/brand digital marketing strategy in line..."
https://kr.indeed.com//rc/clk?jk=8e0e48f94e40a586&fccid=6c6f37e2a6cb4c55&vjs=3,IT Service Mgmt III - (B3),대한민국,,"self-motivated individual able to build and sustain long-
term good relationships with internal customers, colleagues..."
https://kr.indeed.com//rc/clk?jk=a3e74aa5a8da761a&fccid=6b7a1dfe07e7f037&vjs=3,Clinical Research - Translator (Pipeline),서울,,"input. You... part of a global team with exciting long-
term career opportunities. So, if you have an entrepreneurial..."
https://kr.indeed.com//rc/clk?jk=aa493649b139f376&fccid=af17ea0d1d6bbbba&vjs=3,People & Culture Generalist - IKEA Gwangmyeong,경기도,,"through people. You know how to how to implement long-
term plans, according to set budgets and goals. You have knowledge..."
https://kr.indeed.com//rc/clk?jk=eb7c2ad108586b4d&fccid=6f1f9e5eee8c24bd&vjs=3,Plant Controller,충청남도,,"Customer Focus Work Standards / Quality Contributing to Team Success MS office, English, Finance and Accounting 
term"
https://kr.indeed.com//rc/clk?jk=bd518a3019e9f8c8&fccid=ca2285c3548c3efe&vjs=3,Intern (August 2021,서울,,"principal investment. Job no: MAM-957512 Work type: Fixed 
term Location: Seoul Category: Junior, Asset Management, Graduate..."
https://kr.indeed.com//rc/clk?jk=06b3c274e89891eb&fccid=595d42593839d3a2&vjs=3,Account Payable Analyst,서울,,"통과 협업 능력 신속한 의사결정과 대응이 필요한 업무 환경에서의 경험 Condition Type: Fixed 
Term worker ( 계약직) Contract Period: 1-year Location: 한국쓰리엠 서울..."
https://kr.indeed.com//company/National-Geographic-Society---Asia/jobs/Research-Associate-74c621eebb6a5cf5?fccid=63f28ba89dbe3ad1&vjs=3,Research Associate,제주도 제주,,"Explorers Engagement * Type of Contract: Independent Contractor * 
Term: One year... possibility of an extension, based..."
https://kr.indeed.com//rc/clk?jk=5b0e780782510453&fccid=808e2935083ffe8b&vjs=3,Team Assistant,인천,,"commission of any... acts. The 
term “sexual exploitation” means any actual... conditions. The 
term “sexual harassment..."
https://kr.indeed.com//rc/clk?jk=3a971b518fef36bf&fccid=a6a6cb08ca92cc4b&vjs=3,Application Scientist,서울,,"partners and market conditions consistent... long-
term goals... company. Carry out customer demonstrations..."
https://kr.indeed.com//rc/clk?jk=2456cfd18867f542&fccid=e05a0d0b33ce6f6f&vjs=3,외교부 장관 Financial Times紙 인터뷰,서울 종로구,,"kind of mid- and long-
term approach... dilemma we are facing... pursue the mid- and long-
term policies you need..."
https://kr.indeed.com//rc/clk?jk=2fe907bb6c976644&fccid=d060c09e54ed5884&vjs=3,Operator,대한민국,,"strong financial foundation, the Group is sustaining mid-
term growth by executing three strategic drivers: addressing..."
https://kr.indeed.com//rc/clk?jk=e64d2f1e2de938b4&fccid=fe2d21eef233e94a&vjs=3,Solutions Architect,서울,,"managers within your larger organization when discussing mid-
term customer strategy and architectural best practices · We..."
https://kr.indeed.com//rc/clk?jk=114cdf183befabfc&fccid=e39222385459b710&vjs=3,UK University Admissions Strategy Consultant,서울,,"facing responsibilities include driving progress through long-
term roadmaps, offering a perspective into UK higher education..."
https://kr.indeed.com//rc/clk?jk=cfba5f2c2aaf5b53&fccid=71a4f62d64832314&vjs=3,영어가능한 주한 외국인 코디네이터,서울 용산구,"연봉 26,500,000원 - 30,000,000원","Maintenance2. Clients Secretary & Documentary Work3. Short 
Term Staying Accommodation4. Furniture Rental & Sale, Buying..."
https://kr.indeed.com//rc/clk?jk=49220b4afa105236&fccid=a5b4499d9e91a5c6&vjs=3,Financial Accountant,서울,,"deliverables... name Google came from ""googol,"" a mathematical 
term... number 1 followed by 100 zeros. And nobody..."
https://kr.indeed.com//rc/clk?jk=3779d4785a680055&fccid=af17ea0d1d6bbbba&vjs=3,Store Visual Merchandiser / Activity Co-worker - IKEA Goyang...,경기도 고양,,"initiatives... grow the business and support long-
term profitability and execute the agreed plans in close co..."
https://kr.indeed.com//rc/clk?jk=fbc910c7a89fc1b5&fccid=e127f4594cdf24f4&vjs=3,27040 - IT Support Branch & Securities,대한민국,,"initiatives. Documentation and end user education in 
term of application usage, security and best practices. IT Application..."
https://kr.indeed.com//rc/clk?jk=48e738d6a6b3e629&fccid=76bce720eab9a7b0&vjs=3,Material Planner,충청남도 천안,,"contracts or purchase orders. Lead resolution of short-
term supply/demand imbalances. Participates in weekly planning..."
https://kr.indeed.com//rc/clk?jk=e58fb9330631b6a8&fccid=a5b0232167551bf2&vjs=3,Administrative Officer,대한민국,,"Land & base management Certain current or former 
term or temporary federal employees of a land or base management agency..."
https://kr.indeed.com//rc/clk?jk=58858e830592cdd6&fccid=13f90ee3a3cf4d7f&vjs=3,포지션 : 자동차부품사(HKMC 1차 협력사) 경영기획/전략기획,경기도,,"국내외 법인관리- 손익분석- 사업계획 수립- 경영실적 보고[자격요건]- 월별 손익분석 및 Short-
Term, Long-
Term 사업계획수립 가능자- M&A 경험자- 재무회계에 대한 지식보유자-커리어셀파 이창성 수석 010..."
https://kr.indeed.com//rc/clk?jk=89f20c4eca4f47e5&fccid=edae4285faf6c2f0&vjs=3,Industrial Engineer - Korea,부산,,"United States... position... hired on a 2 year fixed 
term contract with possibility to convert to an open ended..."
https://kr.indeed.com//rc/clk?jk=b350146f789be998&fccid=191311fae8e28d8f&vjs=3,Customer Service Rep,경기도,,"analyze short-
term forecast and order... account feedback... relates to short 
term line loading. - Bachelor’s degree..."
https://kr.indeed.com//rc/clk?jk=efab6d4feed3e772&fccid=595d42593839d3a2&vjs=3,Marketing Specialist (수시모집 인재풀 등록),서울,,"analytical skills to analyze trends or marketing data. Uses short-
term planning skills when forecasting or providing guidance..."
https://kr.indeed.com//rc/clk?jk=dfd65d318585d3db&fccid=10fb02f20fcffefb&vjs=3,ACCOUNTANT,대한민국,,"Land & base management Certain current or former 
term or temporary federal employees of a land or base management agency..."
https://kr.indeed.com//rc/clk?jk=c186b486912bd234&fccid=396f5ba534ee585d&vjs=3,Sales Associate (현대 목동),서울,,"mindset is core to our business and key to our long-
term success. JOB PURPOSE To meet and strive to exceed individual..."
https://kr.indeed.com//rc/clk?jk=3766c0f8acc3f7d8&fccid=8b9bafd9d608c198&vjs=3,"Victim Advocate, FASS",대한민국,,"offending caregivers about the dynamics and possible long-
term consequences of child abuse Assess family needs and encourage..."
https://kr.indeed.com//rc/clk?jk=d089d5af8feb5042&fccid=79b1953a75a5cc1a&vjs=3,Adhesive Sales Representative,서울,,"emerging markets. YOUR ROLE Executes local short 
term and long 
term sales plans in line with sub business unit strategy..."
https://kr.indeed.com//rc/clk?jk=dbb267a435043cc4&fccid=692d9c1ea412574e&vjs=3,"Intern, Editorial",서울,,"paid... 4 major Korean insurances provided. The contract 
term is 6 months... position will begin as soon..."
https://kr.indeed.com//rc/clk?jk=2a643a6e29fc9104&fccid=b739c7fad36227f6&vjs=3,외국계 회사 UPS Engineer,경기도 이천,,"after sales service. The best technology is only as good... long 
term... service that underpins... purpose..."
https://kr.indeed.com//rc/clk?jk=29d75efb1aa5b1df&fccid=10fb02f20fcffefb&vjs=3,CREDENTIALS COORDINATOR (OA),대한민국,,"Land & base management Certain current or former 
term or temporary federal employees of a land or base management agency..."
https://kr.indeed.com//rc/clk?jk=2570b1109d3615ce&fccid=a5b0232167551bf2&vjs=3,Administrative Support Assistant (OA),대한민국,,"Land & base management Certain current or former 
term or temporary federal employees of a land or base management agency..."
https://kr.indeed.com//rc/clk?jk=ce8d12aaefe6579d&fccid=f33adcecbae03a00&vjs=3,"Logistics Specialist (1 year, Fixed Term)",서울,,"Who We Are BD is a leading global medical technology company that creates medical technology, devices and laboratory..."
https://kr.indeed.com//rc/clk?jk=91c6ce9461e58e01&fccid=f766f8bfbc3effb7&vjs=3,Safety Investigations Specialist,서울,,"Contribute to building the team... organization for long 
term success Work closely... regional safety program team..."
https://kr.indeed.com//company/Elite-Asia/jobs/Korean-Mt-Post-Editor-c20e7d91540c6a78?fccid=244accb7504d259f&vjs=3,Korean MT Post-Editor - URGENT - 1 month project,서울•원격 근무,,"Making key terminology consistent... depth 
term checking *Requirement* *Eng >Kor... job requires *a one..."
https://kr.indeed.com//rc/clk?jk=b3df63a1bf51272c&fccid=c46411dafcae5d08&vjs=3,Bio Process Contents Developing Internship,서울,,"so you can grow your career and expand your skills... long 
term. Cytiva is proud to work alongside a community of nine..."
https://kr.indeed.com//rc/clk?jk=41db01cc3877d021&fccid=fe2d21eef233e94a&vjs=3,Selling Partner Support Associate,서울,,"Position Description: Global Seller Support Associate (Fixed-
term... Seller Support Associate acts... primary..."
https://kr.indeed.com//rc/clk?jk=a8006b33d45f65a8&fccid=942d238ea16c5cd0&vjs=3,Brand Change Specialist (fixed-term contract: 18-months),서울,,"SAP Master Data lifecycle Worker Type : Fixed 
Term Contract (Fixed 
Term) Primary Location: Seoul Office Additional..."
https://kr.indeed.com//rc/clk?jk=92a174e45e76e062&fccid=79b1953a75a5cc1a&vjs=3,Adhesive Operations Graduate Development Program,인천,,"plant JOB ID: 21017325 Contract & Job type: Full Time, Limited 
Term Contact information for application-related questions..."
https://kr.indeed.com//rc/clk?jk=9eec6f33981cdbb3&fccid=1807e5727f702882&vjs=3,Retail Manager,서울,,"local market and business world Nurture positive long-
term business relations Propose and participate in public relations..."
https://kr.indeed.com//rc/clk?jk=3bade6066ecf95e8&fccid=79b1953a75a5cc1a&vjs=3,Adhesive Technical Customer Service Intern,충청남도 천안,,"months JOB ID: 21018353 Contract & Job type: Full Time, Limited 
Term Contact information for application-related questions..."
https://kr.indeed.com//rc/clk?jk=e4acc7c8df45a38a&fccid=65ae769cb89830ec&vjs=3,INTERN - PUBLIC INFORMATION [Temporary],인천,,"short, medium and long 
term as well... commission of any... acts. The 
term “sexual exploitation” means any actual..."
https://kr.indeed.com//rc/clk?jk=1c30f68b32045107&fccid=af17ea0d1d6bbbba&vjs=3,Country IKEA Food Manager - IKEA Korea,경기도,,"IKEA tone of voice. •Ability to take a holistic and long-
term view and identify business opportunities accordingly combined..."
https://kr.indeed.com//rc/clk?jk=6f6903014017b5c9&fccid=808e2935083ffe8b&vjs=3,Intern - Public Information,인천,,"short, medium and long 
term as well... commission of any... acts. The 
term “sexual exploitation” means any actual..."
https://kr.indeed.com//rc/clk?jk=419692b3ddb34768&fccid=467aefff3a9cf758&vjs=3,Analytics Specialist,서울,,"drive long-
term value... role focuses... uncover opportunities to drive long-
term value Business Facing Project manage..."
https://kr.indeed.com//rc/clk?jk=874e220a355fe468&fccid=0d9dd14963f1f7df&vjs=3,[외국계]게팅게 메디칼 코리아 IWS product specialist,서울 강남구,,"order intake targets- Responsible for building a long-
term relations with hospitals and other stakeholders focusing..."
https://kr.indeed.com//rc/clk?jk=702d0ac22f5ed0be&fccid=65ae769cb89830ec&vjs=3,INTERN - PROGRAMME MANAGEMENT [Temporary],인천,,"commission of any... acts. The 
term “sexual exploitation” means any actual... conditions. The 
term “sexual harassment..."
https://kr.indeed.com//rc/clk?jk=b37c3f984670f5f3&fccid=5edbff99ef018d26&vjs=3,Logistics Management Specialist (Food Service),대한민국,,"Land & base management Certain current or former 
term or temporary federal employees of a land or base management agency..."
https://kr.indeed.com//rc/clk?jk=ee97621fe02d50c1&fccid=c46411dafcae5d08&vjs=3,Market Research Intern,서울,,"so you can grow your career and expand your skills... long 
term. Cytiva is proud to work alongside a community of nine..."
https://kr.indeed.com//rc/clk?jk=8c117f21bc1b0b62&fccid=7a40f18927f81f36&vjs=3,"Help Desk Technician-Temporary-Camp Humphreys, Korea-1980",경기도 평택,,"Help Desk Technician Location: Camp Humphreys, South Korea 
Term: 3 weeks (if vaccinated/ 5 weeks (if un-vaccinated- 2 week..."
https://kr.indeed.com//rc/clk?jk=a825d432af879511&fccid=6576e7250aa78c3c&vjs=3,Consultant - Capital Productivity,서울,,"continuous improvement effort or developing short and long-
term capability-building plans for all relevant levels of client..."
https://kr.indeed.com//rc/clk?jk=330a85c8f8351d91&fccid=595d42593839d3a2&vjs=3,Supply Chain Planning Analyst ( 계약직),전라남도,,"무상 영어 활용 가능자 **입사지원서 제출 시 영어 성적 제출 필수 Condition Type: Fixed 
Term Worker( 계약직 ) Contract Period: 2- years Location: 한국쓰리엠 나주공..."
https://kr.indeed.com//rc/clk?jk=feb1b1346ea01166&fccid=70e676db00165049&vjs=3,Teller,대한민국,,"Land & base management Certain current or former 
term or temporary federal employees of a land or base management agency..."
